{
  "schema_version": 1,
  "id": "eval-tools-v1",
  "name": "Tool calling eval v1",
  "kind": "eval",
  "description": "Runs all 80 items of eval-tools-v1 at temperature 0 and reports accuracy overall, by category and by difficulty. Pinned together with the dataset: a change to either means a new -v2 id.",
  "dataset_id": "eval-tools-v1",
  "params": {
    "concurrency": 4,
    "num_requests": 80,
    "input_tokens": null,
    "output_tokens": 2048,
    "seed": 42,
    "warmup_requests": 0,
    "temperature": 0,
    "repeat": 1,
    "timeout_s": 300,
    "reasoning": "default"
  },
  "sweep": null,
  "eval": {
    "suite": "tools",
    "scorer": "json",
    "pass_threshold": null,
    "max_output_tokens": 2048,
    "categories": [
      "single_call",
      "no_call"
    ],
    "notes": "Send meta.tools as the request's tools parameter with tool_choice='auto' and score tool_calls[0]. The 20 no_call items are correct only when no tool call is made at all."
  },
  "metrics_required": [
    "accuracy",
    "success_rate",
    "avg_latency_ms"
  ],
  "immutable": true,
  "created": "2026-08-23",
  "supersedes": null,
  "notes": "accuracy and avg_latency_ms live in the result's `scores` block, not in `metrics`; success_rate is the share of requests that completed at all and is independent of whether the answers were right."
}
