{
  "schema_version": 1,
  "id": "eval-code-v1",
  "name": "Code eval v1",
  "kind": "eval",
  "description": "Runs all 140 items of eval-code-v1 at temperature 0 and reports accuracy overall, by category and by difficulty. Pinned together with the dataset: a change to either means a new -v2 id.",
  "dataset_id": "eval-code-v1",
  "params": {
    "concurrency": 4,
    "num_requests": 140,
    "input_tokens": null,
    "output_tokens": 4096,
    "seed": 42,
    "warmup_requests": 0,
    "temperature": 0,
    "repeat": 1,
    "timeout_s": 300,
    "reasoning": "default"
  },
  "sweep": null,
  "eval": {
    "suite": "code",
    "scorer": "code-exec",
    "pass_threshold": null,
    "max_output_tokens": 4096,
    "categories": [
      "strings",
      "lists",
      "dicts",
      "math",
      "parsing",
      "recursion",
      "algorithms",
      "edge_cases",
      "bugfix"
    ],
    "notes": "Runs untrusted model output. Execute in a subprocess with no network, a throwaway working directory and the row's meta.timeout_s (default 10 s), never in the harness process."
  },
  "metrics_required": [
    "accuracy",
    "success_rate",
    "avg_latency_ms"
  ],
  "immutable": true,
  "created": "2026-08-23",
  "supersedes": null,
  "notes": "accuracy and avg_latency_ms live in the result's `scores` block, not in `metrics`; success_rate is the share of requests that completed at all and is independent of whether the answers were right."
}
